{"assessed_at":"2026-10-05T12:01:07.100Z","correlated_record_count":0,"evidence_refs":[{"artifact_path":"late-evidence/late-evidence-stream.jsonl","artifact_sha256":"b769a7372e65a3a9b8a29809c7c56c2823ae803767bdfcf15b47625ec6e9cd00"}],"execution_manifest_sha256":"e74ab218bef3d5c57e6cc21108b96ababcc200448df75d7d62acc9751a9b655f","late_evidence_status":"none","monitoring":"complete","monitoring_ended_at":"2026-10-05T12:01:07.000Z","monitoring_started_at":"2026-10-05T12:00:07.000Z","reasons":[],"reassessments":[{"changes":[],"frozen_result_ref":{"artifact_path":"trials/00000000-0000-4000-8000-000000000103/derived/oracle-result.json","artifact_sha256":"96b33de46979a2114db6f917db686a383604f9723f86205d41f9f23880f1b7f5"},"status":"none"}],"record_type":"late_evidence_assessment","run_id":"00000000-0000-4000-8000-000000000100","schema_version":1}
