{"assessed_at":"2026-10-07T04:47:36.777Z","correlated_record_count":0,"evidence_refs":[{"artifact_path":"late-evidence/late-evidence-stream.jsonl","artifact_sha256":"e3b0c44298fc1c149afbf4c8996fb92427ae41e4649b934ca495991b7852b855"}],"execution_manifest_sha256":"03586029b4faa11c0f4c14cc7ea0ad291b0afa25036c91639f97d02a35979a54","late_evidence_status":"none","monitoring":"complete","monitoring_ended_at":"2026-10-07T04:47:16.838Z","monitoring_started_at":"2026-10-07T04:45:16.831Z","reasons":[],"reassessments":[{"changes":[],"frozen_result_ref":{"artifact_path":"probe/derived/transport-probe-result.json","artifact_sha256":"05ffc0d504fbef148b6156e40ce905466fdb87b70bcb1d04ac72ee75f8d143c1"},"status":"none"}],"record_type":"late_evidence_assessment","schema_version":1,"transport_probe_id":"adfca539-508f-4a51-9a98-e1dcf8cec84a"}
