{"assessed_at":"2026-10-07T06:23:03.975Z","correlated_record_count":0,"evidence_refs":[{"artifact_path":"late-evidence/late-evidence-stream.jsonl","artifact_sha256":"e3b0c44298fc1c149afbf4c8996fb92427ae41e4649b934ca495991b7852b855"}],"execution_manifest_sha256":"3d26529048074578c43c303781c3ff54d17c0f4f22f6916fa1348955b66f202e","late_evidence_status":"none","monitoring":"complete","monitoring_ended_at":"2026-10-07T06:22:56.914Z","monitoring_started_at":"2026-10-07T06:20:56.912Z","reasons":[],"reassessments":[{"changes":[],"frozen_result_ref":{"artifact_path":"trials/7fd96973-1eed-4982-8a4e-b654680ce404/derived/oracle-result.json","artifact_sha256":"90c38d8d9953af2aa8b42c370b9a3a963fbf4160e6b7281659ff2388649e443c"},"status":"none","trial_id":"7fd96973-1eed-4982-8a4e-b654680ce404"},{"changes":[],"frozen_result_ref":{"artifact_path":"trials/5a9bbf55-54bf-4ea8-ab29-f5a83b57a288/derived/oracle-result.json","artifact_sha256":"b5feb0a9cb80bc75a30d03d1f4ab0fed2b528c1b3fdbd3adefe945f4ec8cdbe7"},"status":"none","trial_id":"5a9bbf55-54bf-4ea8-ab29-f5a83b57a288"},{"changes":[],"frozen_result_ref":{"artifact_path":"trials/2c1a67fd-3a63-4028-ab2c-61ded755769f/derived/oracle-result.json","artifact_sha256":"3bb92dd34738d47acce8907c721467219ac7b7db16693aa205ad53e39d77fd91"},"status":"none","trial_id":"2c1a67fd-3a63-4028-ab2c-61ded755769f"},{"changes":[],"frozen_result_ref":{"artifact_path":"trials/d16f2b2c-22fe-477a-b974-a6f63d19726f/derived/oracle-result.json","artifact_sha256":"ea9ccd2db9e501544ef77f6fe8c0286edd723aca04a9500c82e109251b0d876f"},"status":"none","trial_id":"d16f2b2c-22fe-477a-b974-a6f63d19726f"}],"record_type":"late_evidence_assessment","run_id":"abf41ffd-3008-4b29-81ee-b65d8095188b","schema_version":1}
